{
  "id": "tpl.me.est_unit_count_easy.v1",
  "version": 1,
  "skill": "ME.EST",
  "grades": [
    4
  ],
  "status": "draft",
  "answer_kind": "value",
  "params": {
    "k": {
      "type": "int",
      "min": 2,
      "max": 9
    },
    "s": {
      "type": "choice",
      "values": [
        2,
        3
      ]
    }
  },
  "answer": {
    "expr": "k * s",
    "format": "measure",
    "unit": "cm",
    "decimal_places": 0
  },
  "difficulty": {
    "base": -3.4,
    "features": [
      {
        "when": "k * s >= 15",
        "add": 0.2,
        "note": "longer total"
      }
    ]
  },
  "distractors": [
    {
      "expr": "k + s",
      "misconception": "add_instead_of_multiply"
    },
    {
      "expr": "k",
      "misconception": "count_not_length"
    },
    {
      "expr": "k * s + s",
      "misconception": "one_group_extra"
    }
  ],
  "prompt": {
    "en": "{k} clips, each about {s} cm long. About ? cm",
    "id": "{k} klip, masing-masing sekitar {s} cm. Kira-kira ? cm"
  },
  "visual_model": "ruler",
  "game_adapters": {
    "orb_forge": {
      "ops": [
        "+"
      ],
      "max_crystals": 2,
      "decoys": 3
    },
    "balloon_burst": {
      "choices": 4
    },
    "bridge_builder": {
      "max_planks": 3,
      "decoys": 3
    }
  },
  "tags": [
    "measurement",
    "estimate",
    "easy"
  ],
  "provenance": {
    "source": "ai",
    "model": "claude-opus-5-5",
    "batch_id": "batch-2026-10-08-a",
    "created_at": "2026-10-08T00:00:00Z"
  }
}
