{
  "id": "tpl.fr.mixed_add_regroup.v1",
  "version": 1,
  "skill": "FR.MIXED",
  "grades": [
    5
  ],
  "status": "draft",
  "answer_kind": "value",
  "params": {
    "d": {
      "type": "int",
      "min": 4,
      "max": 9
    },
    "n": {
      "type": "int",
      "min": 2,
      "max": "d - 1"
    },
    "m": {
      "type": "int",
      "min": "d - n + 1",
      "max": "d - 1"
    },
    "a": {
      "type": "int",
      "min": 1,
      "max": 4
    },
    "b": {
      "type": "int",
      "min": 1,
      "max": 4
    }
  },
  "answer": {
    "expr": "mixed(a + b + 1, n + m - d, d)",
    "format": "mixed",
    "simplify": false
  },
  "difficulty": {
    "base": 1.2,
    "features": [
      {
        "when": "n + m - d >= 3",
        "add": 0.2,
        "note": "larger remainder"
      }
    ]
  },
  "distractors": [
    {
      "expr": "mixed(a + b, n + m - d, d)",
      "misconception": "forgot_carry"
    },
    {
      "expr": "mixed(a + b, n + m, d + d)",
      "misconception": "added_denominators"
    }
  ],
  "prompt": {
    "en": "{a} {n}/{d} + {b} {m}/{d} = ?",
    "id": "{a} {n}/{d} + {b} {m}/{d} = ?"
  },
  "visual_model": "bar_model",
  "game_adapters": {
    "orb_forge": {
      "ops": [
        "+"
      ],
      "max_crystals": 2,
      "decoys": 3
    },
    "balloon_burst": {
      "choices": 4
    },
    "bridge_builder": {
      "max_planks": 3,
      "decoys": 3
    },
    "balance_gate": {
      "unknown_side": "right"
    }
  },
  "tags": [
    "fractions",
    "mixed"
  ],
  "provenance": {
    "source": "ai",
    "model": "claude-opus-5-5",
    "batch_id": "batch-2026-09-30-a",
    "created_at": "2026-09-30T14:00:00Z"
  }
}
