{
  "id": "tpl.fr.compare_smallest_same_den.v1",
  "version": 1,
  "skill": "FR.COMPARE",
  "grades": [
    4
  ],
  "status": "draft",
  "answer_kind": "value",
  "params": {
    "d": {
      "type": "int",
      "min": 6,
      "max": 12
    },
    "a": {
      "type": "int",
      "min": 1,
      "max": 2
    },
    "s": {
      "type": "int",
      "min": 1,
      "max": "floor((d - 1 - a) / 2)"
    },
    "o": {
      "type": "choice",
      "values": [
        0,
        1,
        2
      ]
    },
    "x0": {
      "type": "int",
      "min": "((a) * ((1 - o) * (2 - o) / 2) + (a + s) * (o * (2 - o)) + (a + 2 * s) * (o * (o - 1) / 2))",
      "max": "((a) * ((1 - o) * (2 - o) / 2) + (a + s) * (o * (2 - o)) + (a + 2 * s) * (o * (o - 1) / 2))"
    },
    "x1": {
      "type": "int",
      "min": "((a + s) * ((1 - o) * (2 - o) / 2) + (a + 2 * s) * (o * (2 - o)) + (a) * (o * (o - 1) / 2))",
      "max": "((a + s) * ((1 - o) * (2 - o) / 2) + (a + 2 * s) * (o * (2 - o)) + (a) * (o * (o - 1) / 2))"
    },
    "x2": {
      "type": "int",
      "min": "((a + 2 * s) * ((1 - o) * (2 - o) / 2) + (a) * (o * (2 - o)) + (a + s) * (o * (o - 1) / 2))",
      "max": "((a + 2 * s) * ((1 - o) * (2 - o) / 2) + (a) * (o * (2 - o)) + (a + s) * (o * (o - 1) / 2))"
    }
  },
  "answer": {
    "expr": "frac(a, d)",
    "format": "fraction",
    "simplify": false
  },
  "difficulty": {
    "base": -2.0,
    "features": [
      {
        "when": "s == 1",
        "add": 0.3,
        "note": "close numerators"
      }
    ]
  },
  "distractors": [
    {
      "expr": "frac(a + 2 * s, d)",
      "misconception": "picked_largest"
    },
    {
      "expr": "frac(a + s, d)",
      "misconception": "picked_middle"
    }
  ],
  "prompt": {
    "en": "Smallest: {x0}/{d}, {x1}/{d}, {x2}/{d}?",
    "id": "Terkecil: {x0}/{d}, {x1}/{d}, {x2}/{d}?"
  },
  "visual_model": "bar_model",
  "game_adapters": {
    "orb_forge": {
      "ops": [
        "+"
      ],
      "max_crystals": 2,
      "decoys": 3
    },
    "balloon_burst": {
      "choices": 3
    },
    "bridge_builder": {
      "max_planks": 3,
      "decoys": 3
    }
  },
  "tags": [
    "fractions",
    "compare"
  ],
  "provenance": {
    "source": "ai",
    "model": "claude-opus-5-5",
    "batch_id": "batch-2026-09-30-a",
    "created_at": "2026-09-30T14:00:00Z"
  }
}
