{
  "id": "tpl.fr.equiv_half_easy.v1",
  "version": 1,
  "skill": "FR.EQUIV",
  "grades": [
    4
  ],
  "status": "draft",
  "answer_kind": "value",
  "params": {
    "k": {
      "type": "int",
      "min": 2,
      "max": 6
    }
  },
  "answer": {
    "expr": "k",
    "format": "int"
  },
  "difficulty": {
    "base": -3.4,
    "features": [
      {
        "when": "k >= 5",
        "add": 0.1,
        "note": "larger denominator"
      }
    ]
  },
  "distractors": [
    {
      "expr": "2 * k - 1",
      "misconception": "additive_thinking"
    },
    {
      "expr": "2 * k",
      "misconception": "copied_denominator"
    }
  ],
  "prompt": {
    "en": "1/2 = ?/{=2 * k}",
    "id": "1/2 = ?/{=2 * k}"
  },
  "visual_model": "bar_model",
  "game_adapters": {
    "orb_forge": {
      "ops": [
        "+"
      ],
      "max_crystals": 2,
      "decoys": 3
    },
    "balloon_burst": {
      "choices": 4
    },
    "bridge_builder": {
      "max_planks": 3,
      "decoys": 3
    }
  },
  "tags": [
    "fractions",
    "equivalent",
    "easy"
  ],
  "provenance": {
    "source": "ai",
    "model": "claude-opus-5-5",
    "batch_id": "batch-2026-09-30-a",
    "created_at": "2026-09-30T14:00:00Z"
  }
}
