{
  "id": "tpl.md.prime_which_2digit.v1",
  "version": 1,
  "skill": "MD.PRIME",
  "grades": [
    5
  ],
  "status": "draft",
  "answer_kind": "value",
  "params": {
    "p": {
      "type": "choice",
      "values": [
        17,
        19,
        23,
        29,
        31,
        37,
        41,
        43,
        47
      ]
    }
  },
  "answer": {
    "expr": "p",
    "format": "int"
  },
  "difficulty": {
    "base": 0.2,
    "features": [
      {
        "when": "p >= 37",
        "add": 0.2,
        "note": "larger prime"
      }
    ]
  },
  "distractors": [
    {
      "expr": "p + 1",
      "misconception": "even_number"
    },
    {
      "expr": "p - 1",
      "misconception": "even_number"
    },
    {
      "expr": "3 * (2 * floor(p / 6) + 1)",
      "misconception": "odd_looks_prime"
    }
  ],
  "prompt": {
    "en": "Which number is prime?",
    "id": "Mana bilangan prima?"
  },
  "visual_model": "none",
  "game_adapters": {
    "orb_forge": {
      "ops": [
        "+"
      ],
      "max_crystals": 2,
      "decoys": 3
    },
    "balloon_burst": {
      "choices": 4
    }
  },
  "tags": [
    "primes"
  ],
  "provenance": {
    "source": "ai",
    "model": "claude-opus-5-5",
    "batch_id": "batch-2026-09-30-a",
    "created_at": "2026-09-30T14:00:00Z"
  }
}
