{
  "id": "tpl.pv.round_10_easy.v1",
  "version": 1,
  "skill": "PV.ROUND",
  "grades": [
    4
  ],
  "status": "draft",
  "answer_kind": "value",
  "params": {
    "t": {
      "type": "int",
      "min": 1,
      "max": 9
    },
    "u": {
      "type": "int",
      "min": 1,
      "max": 9
    }
  },
  "answer": {
    "expr": "floor((10 * t + u + 5) / 10) * 10",
    "format": "int"
  },
  "difficulty": {
    "base": -3.3,
    "features": [
      {
        "when": "u == 5",
        "add": 0.3,
        "note": "exactly halfway"
      }
    ]
  },
  "distractors": [
    {
      "expr": "(10 * t) + (10 * t + 10) - (floor((10 * t + u + 5) / 10) * 10)",
      "misconception": "wrong_direction"
    },
    {
      "expr": "10 * t + u",
      "misconception": "not_rounded"
    }
  ],
  "prompt": {
    "en": "{=10 * t + u} to the nearest 10 = ?",
    "id": "{=10 * t + u} dibulatkan ke puluhan = ?"
  },
  "visual_model": "number_line",
  "game_adapters": {
    "orb_forge": {
      "ops": [
        "+"
      ],
      "max_crystals": 2,
      "decoys": 3
    },
    "balloon_burst": {
      "choices": 4
    },
    "bridge_builder": {
      "max_planks": 3,
      "decoys": 3
    }
  },
  "tags": [
    "rounding",
    "easy"
  ],
  "provenance": {
    "source": "ai",
    "model": "claude-opus-5-5",
    "batch_id": "batch-2026-09-30-a",
    "created_at": "2026-09-30T14:00:00Z"
  }
}
