{
  "id": "tpl.fr.of_sixty.v1",
  "version": 1,
  "skill": "FR.OF",
  "grades": [
    5
  ],
  "status": "draft",
  "answer_kind": "value",
  "params": {
    "d": {
      "type": "choice",
      "values": [
        3,
        4,
        5,
        6,
        10,
        12
      ]
    },
    "a": {
      "type": "int",
      "min": 1,
      "max": "d - 1"
    }
  },
  "answer": {
    "expr": "60 * a / d",
    "format": "int"
  },
  "difficulty": {
    "base": -0.2,
    "features": [
      {
        "when": "d >= 10",
        "add": 0.2,
        "note": "many parts"
      }
    ]
  },
  "distractors": [
    {
      "expr": "60 / d",
      "misconception": "unit_part_only"
    },
    {
      "expr": "60 * a",
      "misconception": "multiplied_only"
    },
    {
      "expr": "60 - 60 * a / d",
      "misconception": "gave_the_rest"
    },
    {
      "expr": "60 * a / d + 60 / d",
      "misconception": "one_part_extra"
    }
  ],
  "prompt": {
    "en": "{a}/{d} of 60 = ?",
    "id": "{a}/{d} dari 60 = ?"
  },
  "visual_model": "bar_model",
  "game_adapters": {
    "orb_forge": {
      "ops": [
        "+"
      ],
      "max_crystals": 2,
      "decoys": 3
    },
    "balloon_burst": {
      "choices": 4
    }
  },
  "tags": [
    "fractions",
    "of"
  ],
  "provenance": {
    "source": "ai",
    "model": "claude-opus-5-5",
    "batch_id": "batch-2026-09-30-a",
    "created_at": "2026-09-30T14:00:00Z"
  }
}
