{
  "id": "tpl.pv.compare_largest_4digit.v1",
  "version": 1,
  "skill": "PV.COMPARE",
  "grades": [
    4
  ],
  "status": "draft",
  "answer_kind": "value",
  "params": {
    "a": {
      "type": "int",
      "min": 1000,
      "max": 9999
    },
    "b": {
      "type": "int",
      "min": 1000,
      "max": 9999
    },
    "c": {
      "type": "int",
      "min": 1000,
      "max": 9999
    }
  },
  "constraints": [
    "a != b and b != c and a != c"
  ],
  "answer": {
    "expr": "max(a, b, c)",
    "format": "int"
  },
  "difficulty": {
    "base": -0.8,
    "features": [
      {
        "when": "floor(max(a, b, c) / 1000) == floor((a + b + c - max(a, b, c) - min(a, b, c)) / 1000)",
        "add": 0.4,
        "note": "same thousands digit"
      }
    ]
  },
  "distractors": [
    {
      "expr": "min(a, b, c)",
      "misconception": "picked_smallest"
    },
    {
      "expr": "a + b + c - max(a, b, c) - min(a, b, c)",
      "misconception": "picked_middle"
    }
  ],
  "prompt": {
    "en": "Largest: {a}, {b}, {c}?",
    "id": "Terbesar: {a}, {b}, {c}?"
  },
  "visual_model": "number_line",
  "game_adapters": {
    "orb_forge": {
      "ops": [
        "+"
      ],
      "max_crystals": 2,
      "decoys": 3
    },
    "balloon_burst": {
      "choices": 3
    }
  },
  "tags": [
    "compare"
  ],
  "provenance": {
    "source": "ai",
    "model": "claude-opus-5-5",
    "batch_id": "batch-2026-09-30-a",
    "created_at": "2026-09-30T14:00:00Z"
  }
}
