{
  "id": "tpl.pv.read_digit_value_4.v1",
  "version": 1,
  "skill": "PV.READ",
  "grades": [
    4
  ],
  "status": "draft",
  "answer_kind": "value",
  "params": {
    "a": {
      "type": "int",
      "min": 1,
      "max": 4
    },
    "k": {
      "type": "int",
      "min": 5,
      "max": 9
    },
    "c": {
      "type": "int",
      "min": 0,
      "max": 4
    },
    "d": {
      "type": "int",
      "min": 0,
      "max": 4
    },
    "n": {
      "type": "int",
      "min": "a * 1000 + k * 100 + c * 10 + d",
      "max": "a * 1000 + k * 100 + c * 10 + d"
    }
  },
  "answer": {
    "expr": "k * 100",
    "format": "int"
  },
  "difficulty": {
    "base": -1.2,
    "features": [
      {
        "when": "c == 0",
        "add": 0.2,
        "note": "zero in the number"
      }
    ]
  },
  "distractors": [
    {
      "expr": "k",
      "misconception": "digit_only"
    },
    {
      "expr": "k * 10",
      "misconception": "place_shift_down"
    },
    {
      "expr": "k * 1000",
      "misconception": "place_shift_up"
    }
  ],
  "prompt": {
    "en": "In {n}, the {k} is worth ?",
    "id": "Dalam {n}, angka {k} bernilai ?"
  },
  "visual_model": "blocks",
  "game_adapters": {
    "orb_forge": {
      "ops": [
        "+"
      ],
      "max_crystals": 2,
      "decoys": 3
    },
    "balloon_burst": {
      "choices": 4
    }
  },
  "tags": [
    "place_value"
  ],
  "provenance": {
    "source": "ai",
    "model": "claude-opus-5-5",
    "batch_id": "batch-2026-09-30-a",
    "created_at": "2026-09-30T14:00:00Z"
  }
}
