{
  "id": "tpl.dc.read_expanded.v1",
  "version": 1,
  "skill": "DC.READ",
  "grades": [
    4
  ],
  "status": "draft",
  "answer_kind": "value",
  "params": {
    "a": {
      "type": "int",
      "min": 2,
      "max": 9
    },
    "b": {
      "type": "int",
      "min": 2,
      "max": 4
    },
    "c": {
      "type": "int",
      "min": 5,
      "max": 9
    }
  },
  "answer": {
    "expr": "a + b / 10 + c / 100",
    "format": "decimal",
    "decimal_places": 3
  },
  "difficulty": {
    "base": -1.2,
    "features": [
      {
        "when": "c >= 7",
        "add": 0.1,
        "note": "larger hundredths"
      }
    ]
  },
  "distractors": [
    {
      "expr": "a + c / 10 + b / 100",
      "misconception": "swapped_places"
    },
    {
      "expr": "10 * a + b + c / 10",
      "misconception": "shifted_left"
    },
    {
      "expr": "a + b / 10 + c / 10",
      "misconception": "same_place"
    }
  ],
  "prompt": {
    "en": "{a} ones, {b} tenths, {c} hundredths = ?",
    "id": "{a} satuan, {b} persepuluhan, {c} perseratusan = ?"
  },
  "visual_model": "number_line",
  "game_adapters": {
    "orb_forge": {
      "ops": [
        "+"
      ],
      "max_crystals": 2,
      "decoys": 3
    },
    "balloon_burst": {
      "choices": 4
    },
    "bridge_builder": {
      "max_planks": 3,
      "decoys": 3
    }
  },
  "tags": [
    "decimals"
  ],
  "provenance": {
    "source": "ai",
    "model": "claude-opus-5-5",
    "batch_id": "batch-2026-09-30-a",
    "created_at": "2026-09-30T14:00:00Z"
  }
}
