{
  "id": "tpl.md.sort_multiples.v1",
  "version": 1,
  "skill": "MD.FACTORS",
  "grades": [
    4,
    5
  ],
  "status": "draft",
  "answer_kind": "predicate",
  "params": {
    "k": {
      "type": "choice",
      "values": [
        3,
        4,
        6,
        7,
        8,
        9
      ]
    }
  },
  "predicate": {
    "gates": [
      {
        "rule": "x % k == 0",
        "label": {
          "en": "Multiple of {k}",
          "id": "Kelipatan {k}"
        }
      },
      {
        "rule": "x % k != 0",
        "label": {
          "en": "Not a multiple",
          "id": "Bukan kelipatan"
        }
      }
    ],
    "item_pool": {
      "type": "int",
      "min": 10,
      "max": "k * 12"
    },
    "exclusive": true
  },
  "answer": {
    "expr": "x % k == 0",
    "format": "bool"
  },
  "difficulty": {
    "base": -0.2,
    "features": [
      {
        "when": "k >= 7",
        "add": 0.4,
        "note": "harder times tables"
      }
    ]
  },
  "distractors": [],
  "prompt": {
    "en": "Sort by multiples of {k}",
    "id": "Pilah kelipatan {k}"
  },
  "visual_model": "number_line",
  "game_adapters": {
    "factory_sort": {
      "items_per_wave": 10
    }
  },
  "tags": [
    "multiples",
    "sort"
  ],
  "provenance": {
    "source": "ai",
    "model": "claude-opus-5-5",
    "batch_id": "batch-2026-10-05-sort",
    "created_at": "2026-10-05T09:00:00Z"
  }
}
