{
  "id": "tpl.pv.compare_close_6digit.v1",
  "version": 1,
  "skill": "PV.COMPARE",
  "grades": [
    4
  ],
  "status": "draft",
  "answer_kind": "value",
  "params": {
    "x": {
      "type": "int",
      "min": 101000,
      "max": 899999
    },
    "d": {
      "type": "int",
      "min": 0,
      "max": 1998
    },
    "e": {
      "type": "int",
      "min": 0,
      "max": 1998
    }
  },
  "constraints": [
    "d != 999 and e != 999 and d != e"
  ],
  "answer": {
    "expr": "max(x, x + d - 999, x + e - 999)",
    "format": "int"
  },
  "difficulty": {
    "base": 1.8,
    "features": [
      {
        "when": "max(x, x + d - 999, x + e - 999) - min(x, x + d - 999, x + e - 999) < 500",
        "add": 0.3,
        "note": "very close numbers"
      }
    ]
  },
  "distractors": [
    {
      "expr": "min(x, x + d - 999, x + e - 999)",
      "misconception": "picked_smallest"
    },
    {
      "expr": "3 * x + d + e - 1998 - max(x, x + d - 999, x + e - 999) - min(x, x + d - 999, x + e - 999)",
      "misconception": "picked_middle"
    }
  ],
  "prompt": {
    "en": "Largest: {x}, {=x + d - 999}, {=x + e - 999}?",
    "id": "Terbesar: {x}, {=x + d - 999}, {=x + e - 999}?"
  },
  "visual_model": "number_line",
  "game_adapters": {
    "orb_forge": {
      "ops": [
        "+"
      ],
      "max_crystals": 2,
      "decoys": 3
    },
    "balloon_burst": {
      "choices": 3
    }
  },
  "tags": [
    "compare",
    "hard"
  ],
  "provenance": {
    "source": "ai",
    "model": "claude-opus-5-5",
    "batch_id": "batch-2026-09-30-a",
    "created_at": "2026-09-30T14:00:00Z"
  }
}
