{
  "id": "tpl.md.facts_small.v1",
  "version": 1,
  "skill": "MD.FACTS",
  "grades": [4],
  "status": "draft",
  "answer_kind": "value",
  "params": {
    "a": { "type": "int", "min": 2, "max": 5 },
    "b": { "type": "int", "min": 2, "max": 5 }
  },
  "constraints": [],
  "answer": { "expr": "a * b", "format": "int" },
  "difficulty": {
    "base": -3.0,
    "features": [
      { "when": "a * b > 12", "add": 0.3, "note": "product above 12" }
    ]
  },
  "distractors": [
    { "expr": "a + b", "misconception": "add_instead_of_multiply" },
    { "expr": "a * (b + 1)", "misconception": "one_group_too_many" }
  ],
  "prompt": { "en": "{a} x {b} = ?", "id": "{a} x {b} = ?" },
  "visual_model": "area_grid",
  "game_adapters": {
    "balloon_burst": { "choices": 4 },
    "balance_gate": { "unknown_side": "right" }
  },
  "tags": ["multiplication", "easy"],
  "provenance": { "source": "ai", "model": "claude-opus-5-5", "batch_id": "hand-2026-09-29", "created_at": "2026-09-29T11:15:00Z" }
}
