{
  "id": "tpl.md.facts_div_small.v1",
  "version": 1,
  "skill": "MD.FACTS",
  "grades": [
    4
  ],
  "status": "draft",
  "answer_kind": "value",
  "params": {
    "a": {
      "type": "int",
      "min": 2,
      "max": 5
    },
    "b": {
      "type": "int",
      "min": 2,
      "max": 10
    }
  },
  "answer": {
    "expr": "b",
    "format": "int"
  },
  "difficulty": {
    "base": -2.8,
    "features": [
      {
        "when": "b >= 7",
        "add": 0.2,
        "note": "larger quotient"
      }
    ]
  },
  "distractors": [
    {
      "expr": "a",
      "misconception": "gave_divisor"
    },
    {
      "expr": "b + 1",
      "misconception": "off_by_one"
    },
    {
      "expr": "a * (b - 1)",
      "misconception": "subtracted_once"
    }
  ],
  "prompt": {
    "en": "{=a * b} ÷ {a} = ?",
    "id": "{=a * b} : {a} = ?"
  },
  "visual_model": "area_grid",
  "game_adapters": {
    "orb_forge": {
      "ops": [
        "+"
      ],
      "max_crystals": 2,
      "decoys": 3
    },
    "balloon_burst": {
      "choices": 4
    },
    "balance_gate": {
      "unknown_side": "right"
    }
  },
  "tags": [
    "division",
    "easy"
  ],
  "provenance": {
    "source": "ai",
    "model": "claude-opus-5-5",
    "batch_id": "batch-2026-09-30-a",
    "created_at": "2026-09-30T14:00:00Z"
  }
}
