{
  "id": "tpl.pv.add_5digit.v1",
  "version": 1,
  "skill": "PV.ADD",
  "grades": [
    4
  ],
  "status": "draft",
  "answer_kind": "value",
  "params": {
    "a": {
      "type": "int",
      "min": 10000,
      "max": 49999
    },
    "b": {
      "type": "int",
      "min": 10000,
      "max": 49999
    }
  },
  "answer": {
    "expr": "a + b",
    "format": "int"
  },
  "difficulty": {
    "base": 1.4,
    "features": [
      {
        "when": "a % 1000 + b % 1000 >= 1000",
        "add": 0.3,
        "note": "carry into thousands"
      }
    ]
  },
  "distractors": [
    {
      "expr": "a + b - 1000",
      "misconception": "forgot_carry"
    },
    {
      "expr": "a + b + 100",
      "misconception": "extra_carry"
    }
  ],
  "prompt": {
    "en": "{a} + {b} = ?",
    "id": "{a} + {b} = ?"
  },
  "visual_model": "blocks",
  "game_adapters": {
    "orb_forge": {
      "ops": [
        "+"
      ],
      "max_crystals": 2,
      "decoys": 3
    },
    "balloon_burst": {
      "choices": 4
    }
  },
  "tags": [
    "addition",
    "hard"
  ],
  "provenance": {
    "source": "ai",
    "model": "claude-opus-5-5",
    "batch_id": "batch-2026-09-30-a",
    "created_at": "2026-09-30T14:00:00Z"
  }
}
