{
  "id": "tpl.me.convert_m_and_cm_to_m.v1",
  "version": 1,
  "skill": "ME.CONVERT",
  "grades": [
    4,
    5
  ],
  "status": "draft",
  "answer_kind": "value",
  "params": {
    "m": {
      "type": "int",
      "min": 1,
      "max": 9
    },
    "c": {
      "type": "int",
      "min": 1,
      "max": 99
    }
  },
  "answer": {
    "expr": "m + c / 100",
    "format": "measure",
    "unit": "m",
    "decimal_places": 3
  },
  "difficulty": {
    "base": 0.9,
    "features": [
      {
        "when": "c < 10",
        "add": 0.4,
        "note": "zero in the tenths"
      }
    ]
  },
  "distractors": [
    {
      "expr": "(100 * m + c) / 10",
      "misconception": "used_ten"
    },
    {
      "expr": "(100 * m + c) / 1000",
      "misconception": "used_thousand"
    }
  ],
  "prompt": {
    "en": "{m} m {c} cm = ? m",
    "id": "{m} m {c} cm = ? m"
  },
  "visual_model": "ruler",
  "game_adapters": {
    "orb_forge": {
      "ops": [
        "+"
      ],
      "max_crystals": 2,
      "decoys": 3
    },
    "balloon_burst": {
      "choices": 4
    },
    "bridge_builder": {
      "max_planks": 3,
      "decoys": 3
    }
  },
  "tags": [
    "measurement",
    "convert",
    "decimal"
  ],
  "provenance": {
    "source": "ai",
    "model": "claude-opus-5-5",
    "batch_id": "batch-2026-10-08-a",
    "created_at": "2026-10-08T00:00:00Z"
  }
}
