{
  "id": "tpl.pv.add_2digit_no_carry.v1",
  "version": 1,
  "skill": "PV.ADD",
  "grades": [
    4
  ],
  "status": "draft",
  "answer_kind": "value",
  "params": {
    "p": {
      "type": "int",
      "min": 1,
      "max": 4
    },
    "q": {
      "type": "int",
      "min": 0,
      "max": 4
    },
    "r": {
      "type": "int",
      "min": 1,
      "max": 4
    },
    "s": {
      "type": "int",
      "min": 0,
      "max": 4
    }
  },
  "answer": {
    "expr": "10 * (p + r) + q + s",
    "format": "int"
  },
  "difficulty": {
    "base": -3.3,
    "features": [
      {
        "when": "q + s >= 5",
        "add": 0.1,
        "note": "larger ones"
      }
    ]
  },
  "distractors": [
    {
      "expr": "10 * (p + r) + q + s + 10",
      "misconception": "carry_when_none"
    },
    {
      "expr": "10 * (p + r)",
      "misconception": "ignored_ones"
    }
  ],
  "prompt": {
    "en": "{=10 * p + q} + {=10 * r + s} = ?",
    "id": "{=10 * p + q} + {=10 * r + s} = ?"
  },
  "visual_model": "blocks",
  "game_adapters": {
    "orb_forge": {
      "ops": [
        "+"
      ],
      "max_crystals": 2,
      "decoys": 3
    },
    "balloon_burst": {
      "choices": 4
    },
    "bridge_builder": {
      "max_planks": 3,
      "decoys": 3
    },
    "balance_gate": {
      "unknown_side": "right"
    }
  },
  "tags": [
    "addition",
    "easy"
  ],
  "provenance": {
    "source": "ai",
    "model": "claude-opus-5-5",
    "batch_id": "batch-2026-09-30-a",
    "created_at": "2026-09-30T14:00:00Z"
  }
}
