{
  "id": "tpl.me.perim_equilateral_easy.v1",
  "version": 1,
  "skill": "ME.PERIM",
  "grades": [
    4
  ],
  "status": "draft",
  "answer_kind": "value",
  "params": {
    "s": {
      "type": "int",
      "min": 2,
      "max": 10
    }
  },
  "answer": {
    "expr": "3 * s",
    "format": "measure",
    "unit": "cm",
    "decimal_places": 0
  },
  "difficulty": {
    "base": -3.4,
    "features": [
      {
        "when": "s >= 7",
        "add": 0.2,
        "note": "larger side"
      }
    ]
  },
  "distractors": [
    {
      "expr": "2 * s",
      "misconception": "sides_miscounted"
    },
    {
      "expr": "4 * s",
      "misconception": "used_four_sides"
    },
    {
      "expr": "s * s",
      "misconception": "gave_area"
    }
  ],
  "prompt": {
    "en": "Triangle, all sides {s} cm. Perimeter?",
    "id": "Segitiga, semua sisi {s} cm. Keliling?"
  },
  "visual_model": "none",
  "game_adapters": {
    "orb_forge": {
      "ops": [
        "+"
      ],
      "max_crystals": 2,
      "decoys": 3
    },
    "balloon_burst": {
      "choices": 4
    },
    "bridge_builder": {
      "max_planks": 3,
      "decoys": 3
    }
  },
  "tags": [
    "measurement",
    "perimeter",
    "easy"
  ],
  "provenance": {
    "source": "ai",
    "model": "claude-opus-5-5",
    "batch_id": "batch-2026-10-08-a",
    "created_at": "2026-10-08T00:00:00Z"
  }
}
