{
  "id": "tpl.md.factors_lcm_small.v1",
  "version": 1,
  "skill": "MD.FACTORS",
  "grades": [
    4,
    5
  ],
  "status": "draft",
  "answer_kind": "value",
  "params": {
    "a": {
      "type": "choice",
      "values": [
        2,
        4
      ]
    },
    "b": {
      "type": "choice",
      "values": [
        6,
        8,
        10
      ]
    }
  },
  "answer": {
    "expr": "lcm(a, b)",
    "format": "int"
  },
  "difficulty": {
    "base": 0.6,
    "features": [
      {
        "when": "b == 10",
        "add": 0.2,
        "note": "larger number"
      }
    ]
  },
  "distractors": [
    {
      "expr": "a * b",
      "misconception": "multiplied"
    },
    {
      "expr": "a + b",
      "misconception": "added"
    },
    {
      "expr": "lcm(a, b) - a",
      "misconception": "one_step_short"
    }
  ],
  "prompt": {
    "en": "Least common multiple of {a} and {b}?",
    "id": "KPK dari {a} dan {b} = ?"
  },
  "visual_model": "number_line",
  "game_adapters": {
    "orb_forge": {
      "ops": [
        "+"
      ],
      "max_crystals": 2,
      "decoys": 3
    },
    "balloon_burst": {
      "choices": 4
    }
  },
  "tags": [
    "multiples"
  ],
  "provenance": {
    "source": "ai",
    "model": "claude-opus-5-5",
    "batch_id": "batch-2026-09-30-a",
    "created_at": "2026-09-30T14:00:00Z"
  }
}
